{
  "schema_version": "missing_info.v0",
  "case_id": "D-B04",
  "session_id": "D-B04-S03",
  "missing_items": [
    {
      "missing_id": "missing-003",
      "question": "Which logistics are currently unreliable: transport, exchange timing, homework routine, or all three?",
      "importance": "high",
      "reason_type": "feasibility_gap",
      "related_issues": [
        "school_logistics",
        "parenting_schedule"
      ],
      "first_identified_turn": 2,
      "status": "resolved",
      "note": "The session needs the logistics picture clarified before stronger optioning."
    },
    {
      "missing_id": "missing-001",
      "question": "What transport plan would support school-week exchanges?",
      "importance": "high",
      "reason_type": "feasibility_gap",
      "related_issues": [
        "school_logistics",
        "parenting_schedule"
      ],
      "first_identified_turn": 6,
      "status": "open",
      "note": "Transport planning remains the clearest unresolved feasibility constraint."
    },
    {
      "missing_id": "missing-002",
      "question": "What reliability markers would both parents treat as sufficient for a phased trial?",
      "importance": "high",
      "reason_type": "process_gap",
      "related_issues": [
        "parenting_schedule",
        "communication_protocol"
      ],
      "first_identified_turn": 6,
      "status": "open",
      "note": "Phased optioning needs explicit success conditions."
    }
  ],
  "missing_info_notes": "The unresolved items remain explicit enough to justify continued caution."
}
