{
  "schema_version": "missing_info.v0",
  "case_id": "D-B-RT02",
  "session_id": "D-B-RT02-S04",
  "missing_items": [
    {
      "missing_id": "d-b-rt02-business-valuation",
      "question": "What is the current valuation of Party A's business interest, and what documentation supports that valuation?",
      "importance": "medium",
      "reason_type": "process_gap",
      "related_issues": [
        "business_valuation"
      ],
      "first_identified_turn": 2,
      "status": "open",
      "note": null
    },
    {
      "missing_id": "d-b-rt02-financial-disclosure",
      "question": "What financial accounts, asset statements, and supporting documentation will both parties have access to before settlement discussions proceed?",
      "importance": "medium",
      "reason_type": "process_gap",
      "related_issues": [
        "disclosure_obligations"
      ],
      "first_identified_turn": 2,
      "status": "open",
      "note": null
    }
  ],
  "missing_info_notes": "The unresolved items remain explicit enough to justify continued caution."
}
