{
  "schema_version": "missing_info.v0",
  "case_id": "D-B11",
  "session_id": "D-B11-S02",
  "missing_items": [
    {
      "missing_id": "d-b11-expense-records",
      "question": "What shared expense records and account summaries are available for review before reimbursement expectations are set?",
      "importance": "medium",
      "reason_type": "process_gap",
      "related_issues": [
        "child_expense_coordination",
        "fairness_and_parent_role"
      ],
      "first_identified_turn": 2,
      "status": "open",
      "note": null
    },
    {
      "missing_id": "d-b11-document-sharing-protocol",
      "question": "What document-sharing and written summary process would let both parents review the expense picture before reimbursement expectations are finalized?",
      "importance": "medium",
      "reason_type": "process_gap",
      "related_issues": [
        "child_expense_coordination",
        "communication_protocol",
        "fairness_and_parent_role"
      ],
      "first_identified_turn": 4,
      "status": "open",
      "note": null
    }
  ],
  "missing_info_notes": "The unresolved items remain explicit enough to justify continued caution."
}
