{
  "schema_version": "missing_info.v0",
  "case_id": "D-B03",
  "session_id": "D-B03-S01-generated",
  "missing_items": [
    {
      "missing_id": "missing-001",
      "question": "What form of acknowledgment would feel sufficient to Spouse A before logistics can be discussed?",
      "importance": "high",
      "reason_type": "process_gap",
      "related_issues": [
        "emotional_acknowledgment",
        "process_legitimacy"
      ],
      "first_identified_turn": 2,
      "status": "resolved",
      "note": "The process cannot move to structure until the pace and acknowledgment question is addressed."
    },
    {
      "missing_id": "missing-002",
      "question": "What separation structure features would minimise the required ongoing joint decisions for Spouse A?",
      "importance": "medium",
      "reason_type": "process_gap",
      "related_issues": [
        "separation_structure",
        "emotional_acknowledgment"
      ],
      "first_identified_turn": 4,
      "status": "resolved",
      "note": "The low-contact structure preference needs to be defined before a package can be proposed."
    }
  ],
  "missing_info_notes": "No unresolved missing-information items remained at close."
}
