{
  "schema_version": "missing_info.v0",
  "case_id": "D-B04",
  "session_id": "D-B04-S01",
  "missing_items": [
    {
      "missing_id": "missing-001",
      "question": "What specific transport plan would support school-week exchanges without creating school-day instability?",
      "importance": "high",
      "reason_type": "feasibility_gap",
      "related_issues": [
        "school_logistics",
        "parenting_schedule"
      ],
      "first_identified_turn": 6,
      "status": "open",
      "note": "This is the clearest unresolved constraint on stronger optioning."
    },
    {
      "missing_id": "missing-002",
      "question": "What reliability markers would both parents treat as sufficient for a phased school-week trial?",
      "importance": "high",
      "reason_type": "process_gap",
      "related_issues": [
        "parenting_schedule",
        "communication_protocol"
      ],
      "first_identified_turn": 6,
      "status": "open",
      "note": "The parents showed openness to a phased arrangement only if the success conditions are explicit."
    },
    {
      "missing_id": "missing-003",
      "question": "How should homework and evening-routine responsibility be handled on any trial school-night arrangement?",
      "importance": "medium",
      "reason_type": "feasibility_gap",
      "related_issues": [
        "school_logistics",
        "parenting_schedule"
      ],
      "first_identified_turn": 6,
      "status": "open",
      "note": "The session surfaced this as part of the routine-stability concern but did not resolve it."
    }
  ],
  "missing_info_notes": "The unresolved items are explicit enough to justify M1 caution and to block stronger schedule recommendation."
}
